{
  "candidate_producer_version": "generated-technical-content-v2",
  "case_id": "CASE_9213ACECEA46",
  "complete": true,
  "generated_technical_content_candidates": [
    {
      "candidate_id": "GTC_000003_000060_001405_a04af9d0a8114f2c",
      "completeness": "complete",
      "container": "markdown_fence",
      "continuation_status": "none",
      "detector": {
        "name": "generated-technical-content-v2",
        "version": "2"
      },
      "detector_evidence": [
        "complete_standalone_markdown_fence",
        "import_or_include",
        "declaration",
        "control_flow",
        "call_expression"
      ],
      "end_offset": 1405,
      "fence_language": "python",
      "kind": "source_code",
      "legacy_artifact_id": "ARTIFACT_000003_001",
      "order_within_response": 1,
      "raw_text": "import pytest\nimport datetime\n\n@pytest.fixture\ndef patch_datetime_now(monkeypatch):\n    \"\"\"\n    Fixture for patching the datetime.now() and datetime.utcnow() methods\n    to return a fixed datetime object.\n\n    This fixture creates a subclass of `datetime.datetime` called `mydatetime`,\n    which overrides the `now()` and `utcnow()` class methods to return a fixed\n    datetime object specified by `FAKE_TIME`.\n\n    Parameters:\n        monkeypatch (pytest.MonkeyPatch): The pytest monkeypatch fixture object.\n\n    Returns:\n        type: The subclass of `datetime.datetime` with patched `now()` and `utcnow()`\n        methods.\n\n    Example:\n        This fixture can be used in pytest tests to mock the current date and time:\n\n        ```\n        def test_something(patch_datetime_now):\n            # Use the patched datetime object\n            assert datetime.datetime.now() == datetime.datetime(2010, 12, 25, 17, 5, 55)\n        ```\n    \"\"\"\n\n    class mydatetime(datetime.datetime):\n        FAKE_TIME = datetime.datetime(2010, 12, 25, 17, 5, 55)\n\n        @classmethod\n        def now(cls, tz=None, *args, **kwargs):\n            return cls.FAKE_TIME.replace(tzinfo=tz)\n\n        @classmethod\n        def utcnow(cls, *args, **kwargs):\n            return cls.FAKE_TIME\n\n    monkeypatch.setattr(datetime, \"datetime\", mydatetime)\n    return mydatetime\n",
      "raw_text_sha256": "a04af9d0a8114f2cbcb21942afc3f0cd686a447b478cc872c0de53bd81b6cd7c",
      "source_event_index": 3,
      "source_record_index": 3,
      "source_response_id": "turn_000003",
      "source_turn_text_sha256": "1fd4530228ee6f3215cbe4b121db25d25d9ee31e1c21bdf1651158629b5aaa3b",
      "start_offset": 60,
      "status": "candidate_requires_semantic_review"
    }
  ],
  "methodology_version": "dir-tfg-v2",
  "package_version": "conversation-only-v2",
  "precision": "timestamp",
  "reconstruction_safe": false,
  "records": [
    {},
    {},
    {
      "message": {
        "author": {
          "role": "user"
        },
        "content": {
          "content_type": "text",
          "parts": [
            "Add a docstring to the following Python fixture:\n\n```\n@pytest.fixture\ndef patch_datetime_now(monkeypatch):\n\n    class mydatetime(datetime.datetime):\n        FAKE_TIME = datetime.datetime(2010, 12, 25, 17, 5, 55)\n\n        @classmethod\n        def now(cls, tz=None, *args, **kwargs):\n            return cls.FAKE_TIME.replace(tzinfo=tz)\n\n        @classmethod\n        def utcnow(cls, *args, **kwargs):\n            return cls.FAKE_TIME\n\n    monkeypatch.setattr(datetime, \"datetime\", mydatetime)\n    return mydatetime\n```"
          ]
        },
        "create_time": 1714747685.263301
      }
    },
    {
      "message": {
        "author": {
          "role": "assistant"
        },
        "content": {
          "content_type": "text",
          "parts": [
            "Sure, here's the fixture with a docstring added:\n\n```python\nimport pytest\nimport datetime\n\n@pytest.fixture\ndef patch_datetime_now(monkeypatch):\n    \"\"\"\n    Fixture for patching the datetime.now() and datetime.utcnow() methods\n    to return a fixed datetime object.\n\n    This fixture creates a subclass of `datetime.datetime` called `mydatetime`,\n    which overrides the `now()` and `utcnow()` class methods to return a fixed\n    datetime object specified by `FAKE_TIME`.\n\n    Parameters:\n        monkeypatch (pytest.MonkeyPatch): The pytest monkeypatch fixture object.\n\n    Returns:\n        type: The subclass of `datetime.datetime` with patched `now()` and `utcnow()`\n        methods.\n\n    Example:\n        This fixture can be used in pytest tests to mock the current date and time:\n\n        ```\n        def test_something(patch_datetime_now):\n            # Use the patched datetime object\n            assert datetime.datetime.now() == datetime.datetime(2010, 12, 25, 17, 5, 55)\n        ```\n    \"\"\"\n\n    class mydatetime(datetime.datetime):\n        FAKE_TIME = datetime.datetime(2010, 12, 25, 17, 5, 55)\n\n        @classmethod\n        def now(cls, tz=None, *args, **kwargs):\n            return cls.FAKE_TIME.replace(tzinfo=tz)\n\n        @classmethod\n        def utcnow(cls, *args, **kwargs):\n            return cls.FAKE_TIME\n\n    monkeypatch.setattr(datetime, \"datetime\", mydatetime)\n    return mydatetime\n```\n\nThis docstring provides a clear explanation of what the fixture does, its parameters, return value, and an example of how to use it in tests."
          ]
        },
        "create_time": 1714747695.355598
      }
    }
  ],
  "source_conversation_sha256": "50c9596ae4609449fa84ffc409c039274027be3983764cc2cbb17de6b139b8de",
  "start": "2024-05-03T14:48:05.263301+00:00",
  "temporal_source": "first developer turn in parsed conversation",
  "temporal_status": "derivable",
  "visible_turns": [
    {
      "create_time": 1714747685.263301,
      "event_index": 2,
      "role": "user",
      "source_node_id": "aaa2965b-e074-4f65-a646-e786221b68a9",
      "source_parent_id": "fc53a166-eb3a-4f8f-9ef6-bea1f48af54b",
      "source_record_index": 2,
      "text": "Add a docstring to the following Python fixture:\n\n```\n@pytest.fixture\ndef patch_datetime_now(monkeypatch):\n\n    class mydatetime(datetime.datetime):\n        FAKE_TIME = datetime.datetime(2010, 12, 25, 17, 5, 55)\n\n        @classmethod\n        def now(cls, tz=None, *args, **kwargs):\n            return cls.FAKE_TIME.replace(tzinfo=tz)\n\n        @classmethod\n        def utcnow(cls, *args, **kwargs):\n            return cls.FAKE_TIME\n\n    monkeypatch.setattr(datetime, \"datetime\", mydatetime)\n    return mydatetime\n```",
      "turn_id": "turn_000002"
    },
    {
      "create_time": 1714747695.355598,
      "event_index": 3,
      "role": "assistant",
      "source_node_id": "4d5dd4df-db3c-46c4-a7a8-040ab7f36ead",
      "source_parent_id": "aaa2965b-e074-4f65-a646-e786221b68a9",
      "source_record_index": 3,
      "text": "Sure, here's the fixture with a docstring added:\n\n```python\nimport pytest\nimport datetime\n\n@pytest.fixture\ndef patch_datetime_now(monkeypatch):\n    \"\"\"\n    Fixture for patching the datetime.now() and datetime.utcnow() methods\n    to return a fixed datetime object.\n\n    This fixture creates a subclass of `datetime.datetime` called `mydatetime`,\n    which overrides the `now()` and `utcnow()` class methods to return a fixed\n    datetime object specified by `FAKE_TIME`.\n\n    Parameters:\n        monkeypatch (pytest.MonkeyPatch): The pytest monkeypatch fixture object.\n\n    Returns:\n        type: The subclass of `datetime.datetime` with patched `now()` and `utcnow()`\n        methods.\n\n    Example:\n        This fixture can be used in pytest tests to mock the current date and time:\n\n        ```\n        def test_something(patch_datetime_now):\n            # Use the patched datetime object\n            assert datetime.datetime.now() == datetime.datetime(2010, 12, 25, 17, 5, 55)\n        ```\n    \"\"\"\n\n    class mydatetime(datetime.datetime):\n        FAKE_TIME = datetime.datetime(2010, 12, 25, 17, 5, 55)\n\n        @classmethod\n        def now(cls, tz=None, *args, **kwargs):\n            return cls.FAKE_TIME.replace(tzinfo=tz)\n\n        @classmethod\n        def utcnow(cls, *args, **kwargs):\n            return cls.FAKE_TIME\n\n    monkeypatch.setattr(datetime, \"datetime\", mydatetime)\n    return mydatetime\n```\n\nThis docstring provides a clear explanation of what the fixture does, its parameters, return value, and an example of how to use it in tests.",
      "turn_id": "turn_000003"
    }
  ]
}
