{
  "candidate_producer_version": "generated-technical-content-v2",
  "case_id": "CASE_91E13A588000",
  "complete": true,
  "generated_technical_content_candidates": [
    {
      "candidate_id": "GTC_000003_000792_000910_3aaea4985dea0688",
      "completeness": "complete",
      "container": "markdown_fence",
      "continuation_status": "none",
      "detector": {
        "name": "generated-technical-content-v2",
        "version": "2"
      },
      "detector_evidence": [
        "complete_standalone_markdown_fence",
        "braces",
        "call_expression"
      ],
      "end_offset": 910,
      "fence_language": "python",
      "kind": "source_code",
      "legacy_artifact_id": "ARTIFACT_000003_001",
      "order_within_response": 1,
      "raw_text": "code = \"\"\"\na = 1\nb = 2\nresult = a + b\n\"\"\"\n\nlocals_ = {}\nexec(code, {}, locals_)\nprint(locals_['result'])  # Output: 3\n",
      "raw_text_sha256": "3aaea4985dea068802e658cd42aeb830fabfd545fa347f685712a6e756a61494",
      "source_event_index": 3,
      "source_record_index": 3,
      "source_response_id": "turn_000003",
      "source_turn_text_sha256": "3453c461b90480bcf567132e47122c258bb3188fd3e7e537efab09010d59e20f",
      "start_offset": 792,
      "status": "candidate_requires_semantic_review"
    }
  ],
  "methodology_version": "dir-tfg-v2",
  "package_version": "conversation-only-v2",
  "precision": "timestamp",
  "reconstruction_safe": false,
  "records": [
    {},
    {},
    {
      "message": {
        "author": {
          "role": "user"
        },
        "content": {
          "content_type": "text",
          "parts": [
            "in python, how get the result of exec()"
          ]
        },
        "create_time": 1686853498.254301
      }
    },
    {
      "message": {
        "author": {
          "role": "assistant"
        },
        "content": {
          "content_type": "text",
          "parts": [
            "In Python, the `exec()` function is used to execute dynamically created program, which is either a string or object code. If it is a string, the string is parsed as a suite of Python statements which is then executed. If it is an object code, it is simply executed.\n\nThe `exec()` function does not return any value, hence you can't directly get a result from it like you would from a function that returns a value. \n\nHowever, the `exec()` function optionally takes a globals and locals parameter (both must be dictionaries), which it uses for global and local variables during execution. If you want to get a result from exec, you can pass a dictionary for locals, execute an assignment statement, and then retrieve the result from the locals dictionary.\n\nHere is a small example:\n\n```python\ncode = \"\"\"\na = 1\nb = 2\nresult = a + b\n\"\"\"\n\nlocals_ = {}\nexec(code, {}, locals_)\nprint(locals_['result'])  # Output: 3\n```\n\nIn this example, the code to be executed is a string that declares two variables `a` and `b` and a third variable `result` which is the sum of `a` and `b`. After executing this code with `exec`, the `locals_` dictionary is updated with the values of `a`, `b`, and `result`, and you can get the value of `result` by looking it up in the dictionary.\n\nPlease note, using `exec()` can potentially make your code vulnerable to code injection if you are executing code that comes from an untrusted source or includes user inputs. It is generally best to avoid using `exec()` if possible."
          ]
        },
        "create_time": 1686853525.61934
      }
    }
  ],
  "source_conversation_sha256": "fe9a18cb24e0283535e42135e07d8fe3f38764ed583332e8af1b950df0a281ec",
  "start": "2023-06-15T18:24:58.254301+00:00",
  "temporal_source": "first developer turn in parsed conversation",
  "temporal_status": "derivable",
  "visible_turns": [
    {
      "create_time": 1686853498.254301,
      "event_index": 2,
      "role": "user",
      "source_node_id": "aaa2864a-6cd8-4024-8b96-efa1a39bfda5",
      "source_parent_id": "82d7ce97-1875-4298-b12a-030a8a973218",
      "source_record_index": 2,
      "text": "in python, how get the result of exec()",
      "turn_id": "turn_000002"
    },
    {
      "create_time": 1686853525.61934,
      "event_index": 3,
      "role": "assistant",
      "source_node_id": "ce63e210-343f-4ac7-9009-b211986370d7",
      "source_parent_id": "aaa2864a-6cd8-4024-8b96-efa1a39bfda5",
      "source_record_index": 3,
      "text": "In Python, the `exec()` function is used to execute dynamically created program, which is either a string or object code. If it is a string, the string is parsed as a suite of Python statements which is then executed. If it is an object code, it is simply executed.\n\nThe `exec()` function does not return any value, hence you can't directly get a result from it like you would from a function that returns a value. \n\nHowever, the `exec()` function optionally takes a globals and locals parameter (both must be dictionaries), which it uses for global and local variables during execution. If you want to get a result from exec, you can pass a dictionary for locals, execute an assignment statement, and then retrieve the result from the locals dictionary.\n\nHere is a small example:\n\n```python\ncode = \"\"\"\na = 1\nb = 2\nresult = a + b\n\"\"\"\n\nlocals_ = {}\nexec(code, {}, locals_)\nprint(locals_['result'])  # Output: 3\n```\n\nIn this example, the code to be executed is a string that declares two variables `a` and `b` and a third variable `result` which is the sum of `a` and `b`. After executing this code with `exec`, the `locals_` dictionary is updated with the values of `a`, `b`, and `result`, and you can get the value of `result` by looking it up in the dictionary.\n\nPlease note, using `exec()` can potentially make your code vulnerable to code injection if you are executing code that comes from an untrusted source or includes user inputs. It is generally best to avoid using `exec()` if possible.",
      "turn_id": "turn_000003"
    }
  ]
}
