{
  "candidate_producer_version": "generated-technical-content-v2",
  "case_id": "CASE_194F3A461B65",
  "complete": true,
  "generated_technical_content_candidates": [
    {
      "candidate_id": "GTC_000003_000090_000602_342239ace5773bc6",
      "completeness": "complete",
      "container": "markdown_fence",
      "continuation_status": "none",
      "detector": {
        "name": "generated-technical-content-v2",
        "version": "2"
      },
      "detector_evidence": [
        "complete_standalone_markdown_fence",
        "declaration",
        "control_flow",
        "braces",
        "statement_terminators",
        "call_expression"
      ],
      "end_offset": 602,
      "fence_language": "typescript",
      "kind": "source_code",
      "legacy_artifact_id": "ARTIFACT_000003_001",
      "order_within_response": 1,
      "raw_text": "function getLastCommandTime(state: any): number | null {\n  const getLastTime = (commands: any[]): number | null => {\n    const lastCommand = commands[commands.length - 1];\n    return lastCommand ? lastCommand.unixMillisec : null;\n  };\n\n  const lastCommandTime = getLastTime(state.undoCommands);\n  const lastSongCommandTime = getLastTime(state.undoSongCommands);\n\n  return lastCommandTime && lastSongCommandTime\n    ? Math.max(lastCommandTime, lastSongCommandTime)\n    : lastCommandTime || lastSongCommandTime;\n}\n",
      "raw_text_sha256": "342239ace5773bc664682d8ee2f937052f43ff56563e974526f986374ce224dc",
      "source_event_index": 3,
      "source_record_index": 3,
      "source_response_id": "turn_000003",
      "source_turn_text_sha256": "1a9f8d49eb669c89967c3e384c0516914d793979f8274d17c5ecf551da7dabb8",
      "start_offset": 90,
      "status": "candidate_requires_semantic_review"
    }
  ],
  "methodology_version": "dir-tfg-v2",
  "package_version": "conversation-only-v2",
  "precision": "timestamp",
  "reconstruction_safe": false,
  "records": [
    {},
    {},
    {
      "message": {
        "author": {
          "role": "user"
        },
        "content": {
          "content_type": "text",
          "parts": [
            "こちらのコードを、シンプルながら読みやすいコードにリファクタリングしてください。\n\n      let lastCommandTime: number | null = null;\n      let lastSongCommandTime: number | null = null;\n      if (state.undoCommands.length !== 0) {\n        lastCommandTime =\n          state.undoCommands[state.undoCommands.length - 1].unixMillisec;\n      }\n      if (state.undoSongCommands.length !== 0) {\n        lastSongCommandTime =\n          state.undoSongCommands[state.undoSongCommands.length - 1]\n            .unixMillisec;\n      }\n      if (lastCommandTime != null && lastSongCommandTime != null) {\n        return Math.max(lastCommandTime, lastSongCommandTime);\n      } else if (lastCommandTime != null) {\n        return lastCommandTime;\n      } else if (lastSongCommandTime != null) {\n        return lastSongCommandTime;\n      }\n      return null;"
          ]
        },
        "create_time": 1708280221.691805
      }
    },
    {
      "message": {
        "author": {
          "role": "assistant"
        },
        "content": {
          "content_type": "text",
          "parts": [
            "以下のコードは、指定されたコードをよりシンプルかつ読みやすくリファクタリングしたものです。ここでは、繰り返しを避け、コードの意図を明確にしています。\n\n```typescript\nfunction getLastCommandTime(state: any): number | null {\n  const getLastTime = (commands: any[]): number | null => {\n    const lastCommand = commands[commands.length - 1];\n    return lastCommand ? lastCommand.unixMillisec : null;\n  };\n\n  const lastCommandTime = getLastTime(state.undoCommands);\n  const lastSongCommandTime = getLastTime(state.undoSongCommands);\n\n  return lastCommandTime && lastSongCommandTime\n    ? Math.max(lastCommandTime, lastSongCommandTime)\n    : lastCommandTime || lastSongCommandTime;\n}\n```\n\nこのリファクタリングにより、次の改善が行われています：\n\n1. **関数の導入**：コードの重複を避けるために、共通のロジックを扱う`getLastTime`関数を導入しました。これにより、`undoCommands`と`undoSongCommands`の最後のコマンド時間を取得する処理を簡素化しています。\n\n2. **条件式の簡素化**：最後のコマンド時間と最後の曲コマンド時間の比較に三項演算子を使用し、コードの可読性を高めています。また、`||`演算子を用いて、どちらかの値が`null`ではない場合にその値を返すようにしています。\n\nこのリファクタリングにより、コードはより簡潔で読みやすくなり、同じ機能を保持しながらメンテナンスしやすくなります。"
          ]
        },
        "create_time": 1708280255.190572
      }
    }
  ],
  "source_conversation_sha256": "2634b53c62ba4ee3cea3ad9e82eaf4ce48e4fe6172f4d44fd5989f6506ecaf32",
  "start": "2024-02-18T18:17:01.691805+00:00",
  "temporal_source": "first developer turn in parsed conversation",
  "temporal_status": "derivable",
  "visible_turns": [
    {
      "create_time": 1708280221.691805,
      "event_index": 2,
      "role": "user",
      "source_node_id": "aaa2ade2-dea1-444e-b23a-721c27214fa2",
      "source_parent_id": "60229cfc-aef6-4f0a-a866-be99dac4b861",
      "source_record_index": 2,
      "text": "こちらのコードを、シンプルながら読みやすいコードにリファクタリングしてください。\n\n      let lastCommandTime: number | null = null;\n      let lastSongCommandTime: number | null = null;\n      if (state.undoCommands.length !== 0) {\n        lastCommandTime =\n          state.undoCommands[state.undoCommands.length - 1].unixMillisec;\n      }\n      if (state.undoSongCommands.length !== 0) {\n        lastSongCommandTime =\n          state.undoSongCommands[state.undoSongCommands.length - 1]\n            .unixMillisec;\n      }\n      if (lastCommandTime != null && lastSongCommandTime != null) {\n        return Math.max(lastCommandTime, lastSongCommandTime);\n      } else if (lastCommandTime != null) {\n        return lastCommandTime;\n      } else if (lastSongCommandTime != null) {\n        return lastSongCommandTime;\n      }\n      return null;",
      "turn_id": "turn_000002"
    },
    {
      "create_time": 1708280255.190572,
      "event_index": 3,
      "role": "assistant",
      "source_node_id": "4a57a074-51de-43c1-a9dd-8a9dce810a84",
      "source_parent_id": "aaa2ade2-dea1-444e-b23a-721c27214fa2",
      "source_record_index": 3,
      "text": "以下のコードは、指定されたコードをよりシンプルかつ読みやすくリファクタリングしたものです。ここでは、繰り返しを避け、コードの意図を明確にしています。\n\n```typescript\nfunction getLastCommandTime(state: any): number | null {\n  const getLastTime = (commands: any[]): number | null => {\n    const lastCommand = commands[commands.length - 1];\n    return lastCommand ? lastCommand.unixMillisec : null;\n  };\n\n  const lastCommandTime = getLastTime(state.undoCommands);\n  const lastSongCommandTime = getLastTime(state.undoSongCommands);\n\n  return lastCommandTime && lastSongCommandTime\n    ? Math.max(lastCommandTime, lastSongCommandTime)\n    : lastCommandTime || lastSongCommandTime;\n}\n```\n\nこのリファクタリングにより、次の改善が行われています：\n\n1. **関数の導入**：コードの重複を避けるために、共通のロジックを扱う`getLastTime`関数を導入しました。これにより、`undoCommands`と`undoSongCommands`の最後のコマンド時間を取得する処理を簡素化しています。\n\n2. **条件式の簡素化**：最後のコマンド時間と最後の曲コマンド時間の比較に三項演算子を使用し、コードの可読性を高めています。また、`||`演算子を用いて、どちらかの値が`null`ではない場合にその値を返すようにしています。\n\nこのリファクタリングにより、コードはより簡潔で読みやすくなり、同じ機能を保持しながらメンテナンスしやすくなります。",
      "turn_id": "turn_000003"
    }
  ]
}
