{
  "candidate_producer_version": "generated-technical-content-v2",
  "case_id": "CASE_7EA4C03D1DDC",
  "complete": true,
  "generated_technical_content_candidates": [
    {
      "candidate_id": "GTC_000003_000213_001499_0644f87bef06244b",
      "completeness": "complete",
      "container": "markdown_fence",
      "continuation_status": "none",
      "detector": {
        "name": "generated-technical-content-v2",
        "version": "2"
      },
      "detector_evidence": [
        "complete_standalone_markdown_fence",
        "braces",
        "call_expression"
      ],
      "end_offset": 1499,
      "fence_language": "ruby",
      "kind": "source_code",
      "legacy_artifact_id": "ARTIFACT_000003_001",
      "order_within_response": 1,
      "raw_text": "# spec/your_fix_spec.rb\n\nrequire 'rails_helper'\n\nRSpec.describe \"Filtering sensitive parameters in logs\" do\n  it \"filters out secret values from logs\" do\n    # Mocking a controller action with sensitive parameters\n    params = { \n      passw: \"password\",\n      secret: \"secret_value\",\n      token: \"access_token\",\n      _key: \"api_key\",\n      crypt: \"encrypted_value\",\n      salt: \"salt_value\",\n      certificate: \"certificate_data\",\n      otp: \"123456\",\n      ssn: \"123-45-6789\"\n    }\n    \n    controller = ApplicationController.new\n    allow(controller).to receive(:params).and_return(params)\n    \n    # Trigger the action that logs the parameters\n    controller.action_that_logs_parameters\n    \n    # Fetch the logs\n    logs = Rails.logger.instance_variable_get(:@logdev).dev.string\n    \n    # Ensure that the sensitive parameters are filtered in logs\n    expect(logs).not_to include(\"password\")\n    expect(logs).not_to include(\"secret_value\")\n    expect(logs).not_to include(\"access_token\")\n    expect(logs).not_to include(\"api_key\")\n    expect(logs).not_to include(\"encrypted_value\")\n    expect(logs).not_to include(\"salt_value\")\n    expect(logs).not_to include(\"certificate_data\")\n    expect(logs).not_to include(\"123456\")\n    expect(logs).not_to include(\"123-45-6789\")\n  end\nend\n",
      "raw_text_sha256": "0644f87bef06244b4d8b2278ff9ef42e709b4a24fb9da3dbff95797ead16321c",
      "source_event_index": 3,
      "source_record_index": 3,
      "source_response_id": "turn_000003",
      "source_turn_text_sha256": "d411797456b50b0197d816cbb0a3c8aeece28d04d5e29fd7f002005938a7cab9",
      "start_offset": 213,
      "status": "candidate_requires_semantic_review"
    }
  ],
  "methodology_version": "dir-tfg-v2",
  "package_version": "conversation-only-v2",
  "precision": "timestamp",
  "reconstruction_safe": false,
  "records": [
    {},
    {},
    {
      "message": {
        "author": {
          "role": "user"
        },
        "content": {
          "content_type": "text",
          "parts": [
            "when using activerecord-multi-tenant library in my rails  project, filters does not work. I prepared a fix and now I want to unit test it to see that fix is actually working.  \nMy non-working code block is as below (not filtering secret values in logs)\nRails.application.config.filter_parameters += [\n  :passw, :secret, :token, :_key, :crypt, :salt, :certificate, :otp, :ssn\n]\nCan you give me a unit test to test this issue?"
          ]
        },
        "create_time": 1685882958.324936
      }
    },
    {
      "message": {
        "author": {
          "role": "assistant"
        },
        "content": {
          "content_type": "text",
          "parts": [
            "Certainly! I can help you with a unit test to verify that the fix for filtering sensitive parameters in logs is working correctly. Here's an example test using RSpec that you can use as a starting point:\n\n```ruby\n# spec/your_fix_spec.rb\n\nrequire 'rails_helper'\n\nRSpec.describe \"Filtering sensitive parameters in logs\" do\n  it \"filters out secret values from logs\" do\n    # Mocking a controller action with sensitive parameters\n    params = { \n      passw: \"password\",\n      secret: \"secret_value\",\n      token: \"access_token\",\n      _key: \"api_key\",\n      crypt: \"encrypted_value\",\n      salt: \"salt_value\",\n      certificate: \"certificate_data\",\n      otp: \"123456\",\n      ssn: \"123-45-6789\"\n    }\n    \n    controller = ApplicationController.new\n    allow(controller).to receive(:params).and_return(params)\n    \n    # Trigger the action that logs the parameters\n    controller.action_that_logs_parameters\n    \n    # Fetch the logs\n    logs = Rails.logger.instance_variable_get(:@logdev).dev.string\n    \n    # Ensure that the sensitive parameters are filtered in logs\n    expect(logs).not_to include(\"password\")\n    expect(logs).not_to include(\"secret_value\")\n    expect(logs).not_to include(\"access_token\")\n    expect(logs).not_to include(\"api_key\")\n    expect(logs).not_to include(\"encrypted_value\")\n    expect(logs).not_to include(\"salt_value\")\n    expect(logs).not_to include(\"certificate_data\")\n    expect(logs).not_to include(\"123456\")\n    expect(logs).not_to include(\"123-45-6789\")\n  end\nend\n```\n\nIn this example, we create a mock controller and override the `params` method to return a hash containing sensitive parameter values. Then, we invoke the action that logs the parameters. After that, we fetch the logs from the logger and assert that the sensitive values are filtered out.\n\nMake sure you replace `action_that_logs_parameters` with the actual method name in your code that logs the parameters. Additionally, modify the example to fit your project's file structure and testing framework if necessary.\n\nRemember to include the necessary dependencies, such as `rails_helper`, in the test file, and configure your testing environment to load the required files.\n\nThis test should help you verify that the fix properly filters out the sensitive parameter values from the logs."
          ]
        },
        "create_time": 1685882976.209461
      }
    }
  ],
  "source_conversation_sha256": "b1280212cf3bf914d72493c3a57dcba0c9fc4c2740a570a832c56c159d4523f7",
  "start": "2023-06-04T12:49:18.324936+00:00",
  "temporal_source": "first developer turn in parsed conversation",
  "temporal_status": "derivable",
  "visible_turns": [
    {
      "create_time": 1685882958.324936,
      "event_index": 2,
      "role": "user",
      "source_node_id": "aaa2c1ce-5685-4f05-b31a-767a2624f7d7",
      "source_parent_id": "f5889e14-ceff-4361-9559-0a2480ce6944",
      "source_record_index": 2,
      "text": "when using activerecord-multi-tenant library in my rails  project, filters does not work. I prepared a fix and now I want to unit test it to see that fix is actually working.  \nMy non-working code block is as below (not filtering secret values in logs)\nRails.application.config.filter_parameters += [\n  :passw, :secret, :token, :_key, :crypt, :salt, :certificate, :otp, :ssn\n]\nCan you give me a unit test to test this issue?",
      "turn_id": "turn_000002"
    },
    {
      "create_time": 1685882976.209461,
      "event_index": 3,
      "role": "assistant",
      "source_node_id": "b1885b60-9a5a-4a49-95c2-346facf6220d",
      "source_parent_id": "aaa2c1ce-5685-4f05-b31a-767a2624f7d7",
      "source_record_index": 3,
      "text": "Certainly! I can help you with a unit test to verify that the fix for filtering sensitive parameters in logs is working correctly. Here's an example test using RSpec that you can use as a starting point:\n\n```ruby\n# spec/your_fix_spec.rb\n\nrequire 'rails_helper'\n\nRSpec.describe \"Filtering sensitive parameters in logs\" do\n  it \"filters out secret values from logs\" do\n    # Mocking a controller action with sensitive parameters\n    params = { \n      passw: \"password\",\n      secret: \"secret_value\",\n      token: \"access_token\",\n      _key: \"api_key\",\n      crypt: \"encrypted_value\",\n      salt: \"salt_value\",\n      certificate: \"certificate_data\",\n      otp: \"123456\",\n      ssn: \"123-45-6789\"\n    }\n    \n    controller = ApplicationController.new\n    allow(controller).to receive(:params).and_return(params)\n    \n    # Trigger the action that logs the parameters\n    controller.action_that_logs_parameters\n    \n    # Fetch the logs\n    logs = Rails.logger.instance_variable_get(:@logdev).dev.string\n    \n    # Ensure that the sensitive parameters are filtered in logs\n    expect(logs).not_to include(\"password\")\n    expect(logs).not_to include(\"secret_value\")\n    expect(logs).not_to include(\"access_token\")\n    expect(logs).not_to include(\"api_key\")\n    expect(logs).not_to include(\"encrypted_value\")\n    expect(logs).not_to include(\"salt_value\")\n    expect(logs).not_to include(\"certificate_data\")\n    expect(logs).not_to include(\"123456\")\n    expect(logs).not_to include(\"123-45-6789\")\n  end\nend\n```\n\nIn this example, we create a mock controller and override the `params` method to return a hash containing sensitive parameter values. Then, we invoke the action that logs the parameters. After that, we fetch the logs from the logger and assert that the sensitive values are filtered out.\n\nMake sure you replace `action_that_logs_parameters` with the actual method name in your code that logs the parameters. Additionally, modify the example to fit your project's file structure and testing framework if necessary.\n\nRemember to include the necessary dependencies, such as `rails_helper`, in the test file, and configure your testing environment to load the required files.\n\nThis test should help you verify that the fix properly filters out the sensitive parameter values from the logs.",
      "turn_id": "turn_000003"
    }
  ]
}
