{
  "candidate_producer_version": "generated-technical-content-v2",
  "case_id": "CASE_5D45BE40E95A",
  "complete": true,
  "generated_technical_content_candidates": [
    {
      "candidate_id": "GTC_000003_000460_000865_c8386fc6193a4e2b",
      "completeness": "complete",
      "container": "markdown_fence",
      "continuation_status": "none",
      "detector": {
        "name": "generated-technical-content-v2",
        "version": "2"
      },
      "detector_evidence": [
        "complete_standalone_markdown_fence",
        "import_or_include",
        "declaration"
      ],
      "end_offset": 865,
      "fence_language": "python",
      "kind": "source_code",
      "legacy_artifact_id": "ARTIFACT_000003_001",
      "order_within_response": 1,
      "raw_text": "from dataclasses import dataclass\nfrom typing import List, Union, Optional\n\n@dataclass\nclass TimeSlot:\n    start_time: int\n    end_time: int\n    status: str\n    object: str\n\n@dataclass\nclass FreeBusy:\n    email: str\n    time_slots: List[TimeSlot]\n    object: str\n\n@dataclass\nclass Error:\n    email: str\n    error: str\n    object: str\n\n@dataclass\nclass ResponseData:\n    data: List[Union[FreeBusy, Error]]\n",
      "raw_text_sha256": "c8386fc6193a4e2b9dfa285256fa992f25bd275a5546ed62c08b44e68c76c7fe",
      "source_event_index": 3,
      "source_record_index": 3,
      "source_response_id": "turn_000003",
      "source_turn_text_sha256": "a161a2ccecfdc96d00f456b7f1917ef12863c5e12a4dd7822e1524279e595dc4",
      "start_offset": 460,
      "status": "candidate_requires_semantic_review"
    }
  ],
  "methodology_version": "dir-tfg-v2",
  "package_version": "conversation-only-v2",
  "precision": "timestamp",
  "reconstruction_safe": false,
  "records": [
    {},
    {},
    {
      "message": {
        "author": {
          "role": "user"
        },
        "content": {
          "content_type": "text",
          "parts": [
            "How can I represent the following JSON response as a Python 3 dataclass model?\n\n\"data\": [\n{\n\"email\": \"user1@nylas.com\",\n\"time_slots\": [\n{\n\"start_time\": 1690898400,\n\"end_time\": 1690902000,\n\"status\": \"busy\",\n\"object\": \"time_slot\"\n},\n{\n\"start_time\": 1691064000,\n\"end_time\": 1691067600,\n\"status\": \"busy\",\n\"object\": \"time_slot\"\n}],\n\"object\": \"free_busy\"\n},\n{\n\"email\": \"user2@nylas.com\",\n\"error\": \"Unable to resolve e-mail address user2@nylas.com to an Active Directory object.\",\n\"object\": \"error\"\n}]"
          ]
        },
        "create_time": 1696287955.804377
      }
    },
    {
      "message": {
        "author": {
          "role": "assistant"
        },
        "content": {
          "content_type": "text",
          "parts": [
            "To represent the given JSON response as a Python 3 dataclass model, you can create multiple dataclasses to represent different parts of the JSON structure. For this JSON structure, you would need at least three dataclasses: one for the top-level data, one for the `free_busy` object, and one for the `time_slot` object. Additionally, a fourth dataclass to handle the `error` object could be useful. Here's how you could structure these dataclasses:\n\n```python\nfrom dataclasses import dataclass\nfrom typing import List, Union, Optional\n\n@dataclass\nclass TimeSlot:\n    start_time: int\n    end_time: int\n    status: str\n    object: str\n\n@dataclass\nclass FreeBusy:\n    email: str\n    time_slots: List[TimeSlot]\n    object: str\n\n@dataclass\nclass Error:\n    email: str\n    error: str\n    object: str\n\n@dataclass\nclass ResponseData:\n    data: List[Union[FreeBusy, Error]]\n```\n\nIn this code:\n\n1. The `TimeSlot` dataclass represents the individual time slot objects.\n2. The `FreeBusy` dataclass represents the `free_busy` object, containing a list of `TimeSlot` objects.\n3. The `Error` dataclass represents the `error` object.\n4. The `ResponseData` dataclass represents the top-level data structure, containing a list of either `FreeBusy` or `Error` objects.\n\nWith these dataclasses, you can now easily parse the JSON response into a Python object using the `dataclasses_json` library or similar libraries."
          ]
        },
        "create_time": 1696287973.290606
      }
    }
  ],
  "source_conversation_sha256": "6a629fcbb7194e69cbbfce95ebede9d7cdddd1952c73ab203f9d5007d8ed827f",
  "start": "2023-10-02T23:05:55.804377+00:00",
  "temporal_source": "first developer turn in parsed conversation",
  "temporal_status": "derivable",
  "visible_turns": [
    {
      "create_time": 1696287955.804377,
      "event_index": 2,
      "role": "user",
      "source_node_id": "aaa27846-c5b5-49a4-a0f2-0d39262870e5",
      "source_parent_id": "b1e31f8f-bd94-4bcd-93f6-b941cbd0a64a",
      "source_record_index": 2,
      "text": "How can I represent the following JSON response as a Python 3 dataclass model?\n\n\"data\": [\n{\n\"email\": \"user1@nylas.com\",\n\"time_slots\": [\n{\n\"start_time\": 1690898400,\n\"end_time\": 1690902000,\n\"status\": \"busy\",\n\"object\": \"time_slot\"\n},\n{\n\"start_time\": 1691064000,\n\"end_time\": 1691067600,\n\"status\": \"busy\",\n\"object\": \"time_slot\"\n}],\n\"object\": \"free_busy\"\n},\n{\n\"email\": \"user2@nylas.com\",\n\"error\": \"Unable to resolve e-mail address user2@nylas.com to an Active Directory object.\",\n\"object\": \"error\"\n}]",
      "turn_id": "turn_000002"
    },
    {
      "create_time": 1696287973.290606,
      "event_index": 3,
      "role": "assistant",
      "source_node_id": "ee5a15c6-0df4-4d23-841e-c435efae939f",
      "source_parent_id": "aaa27846-c5b5-49a4-a0f2-0d39262870e5",
      "source_record_index": 3,
      "text": "To represent the given JSON response as a Python 3 dataclass model, you can create multiple dataclasses to represent different parts of the JSON structure. For this JSON structure, you would need at least three dataclasses: one for the top-level data, one for the `free_busy` object, and one for the `time_slot` object. Additionally, a fourth dataclass to handle the `error` object could be useful. Here's how you could structure these dataclasses:\n\n```python\nfrom dataclasses import dataclass\nfrom typing import List, Union, Optional\n\n@dataclass\nclass TimeSlot:\n    start_time: int\n    end_time: int\n    status: str\n    object: str\n\n@dataclass\nclass FreeBusy:\n    email: str\n    time_slots: List[TimeSlot]\n    object: str\n\n@dataclass\nclass Error:\n    email: str\n    error: str\n    object: str\n\n@dataclass\nclass ResponseData:\n    data: List[Union[FreeBusy, Error]]\n```\n\nIn this code:\n\n1. The `TimeSlot` dataclass represents the individual time slot objects.\n2. The `FreeBusy` dataclass represents the `free_busy` object, containing a list of `TimeSlot` objects.\n3. The `Error` dataclass represents the `error` object.\n4. The `ResponseData` dataclass represents the top-level data structure, containing a list of either `FreeBusy` or `Error` objects.\n\nWith these dataclasses, you can now easily parse the JSON response into a Python object using the `dataclasses_json` library or similar libraries.",
      "turn_id": "turn_000003"
    }
  ]
}
