{
  "candidate_producer_version": "generated-technical-content-v2",
  "case_id": "CASE_A48E956577BA",
  "complete": true,
  "generated_technical_content_candidates": [
    {
      "candidate_id": "GTC_000003_000370_000467_414ecd7027fc370b",
      "completeness": "complete",
      "container": "markdown_fence",
      "continuation_status": "none",
      "detector": {
        "name": "generated-technical-content-v2",
        "version": "2"
      },
      "detector_evidence": [
        "complete_standalone_markdown_fence",
        "recognized_fence_label"
      ],
      "end_offset": 467,
      "fence_language": "python",
      "kind": "source_code",
      "legacy_artifact_id": "ARTIFACT_000003_001",
      "order_within_response": 1,
      "raw_text": "rep_tunes = RepertoireTune.objects.filter(player=user)\ntunes = [tune.tune for tune in rep_tunes]\n",
      "raw_text_sha256": "414ecd7027fc370b98e1ae4851ec778fc3e1abb66bbf75d73e135135e22d1992",
      "source_event_index": 3,
      "source_record_index": 3,
      "source_response_id": "turn_000003",
      "source_turn_text_sha256": "b1e87d8ae20e5de094507814d8578a2341790cf816dfd8f177b6e95bf79adc99",
      "start_offset": 370,
      "status": "candidate_requires_semantic_review"
    },
    {
      "candidate_id": "GTC_000003_001354_001474_d3e2a3a49fd54878",
      "completeness": "complete",
      "container": "markdown_fence",
      "continuation_status": "none",
      "detector": {
        "name": "generated-technical-content-v2",
        "version": "2"
      },
      "detector_evidence": [
        "complete_standalone_markdown_fence",
        "recognized_fence_label"
      ],
      "end_offset": 1474,
      "fence_language": "python",
      "kind": "source_code",
      "legacy_artifact_id": "ARTIFACT_000003_002",
      "order_within_response": 2,
      "raw_text": "rep_tunes = RepertoireTune.objects.filter(player=user).select_related('tune')\ntunes = [tune.tune for tune in rep_tunes]\n",
      "raw_text_sha256": "d3e2a3a49fd54878b6db8822d173dd640aeb43f583f301ae60417d8a7459ace3",
      "source_event_index": 3,
      "source_record_index": 3,
      "source_response_id": "turn_000003",
      "source_turn_text_sha256": "b1e87d8ae20e5de094507814d8578a2341790cf816dfd8f177b6e95bf79adc99",
      "start_offset": 1354,
      "status": "candidate_requires_semantic_review"
    }
  ],
  "methodology_version": "dir-tfg-v2",
  "package_version": "conversation-only-v2",
  "precision": "timestamp",
  "reconstruction_safe": false,
  "records": [
    {},
    {},
    {
      "message": {
        "author": {
          "role": "user"
        },
        "content": {
          "content_type": "text",
          "parts": [
            "is there a N+1 potential in this django code?\n\ndef tune_list(request):\n     user = request.user\n     rep_tunes = RepertoireTune.objects.filter(player=user)\n     tunes = [tune.tune for tune in rep_tunes]"
          ]
        },
        "create_time": 1701966405.333439
      }
    },
    {
      "message": {
        "author": {
          "role": "assistant"
        },
        "content": {
          "content_type": "text",
          "parts": [
            "To evaluate the potential for an N+1 query issue in the provided Django code, let's examine how the queries and data retrieval are structured:\n\nThe code you provided does the following:\n\n1. It fetches `RepertoireTune` objects that are filtered by `player=user`.\n2. Then, it iterates over these objects to access the `tune` attribute of each `RepertoireTune`.\n\n```python\nrep_tunes = RepertoireTune.objects.filter(player=user)\ntunes = [tune.tune for tune in rep_tunes]\n```\n\nAn N+1 problem arises when a query inside a loop leads to a scenario where one initial query is made to retrieve N objects, and then additional queries are made for each of these N objects, resulting in N+1 total queries. This can severely impact performance, especially as N grows larger.\n\nIn this code, the potential N+1 issue depends on how the `tune` attribute is defined in the `RepertoireTune` model. If `tune` is a ForeignKey or a OneToOneField, then accessing `tune.tune` for each `RepertoireTune` object in the list could result in additional queries to the database, one for each `RepertoireTune` object. This is a classic N+1 problem.\n\nTo fix this, you could use `select_related` which is designed for this exact scenario. `select_related` will perform a SQL join and fetch the related objects in the same database query. Here's how you would modify the code:\n\n```python\nrep_tunes = RepertoireTune.objects.filter(player=user).select_related('tune')\ntunes = [tune.tune for tune in rep_tunes]\n```\n\nWith `select_related('tune')`, Django will fetch the related `tune` objects in the same query used to fetch `RepertoireTune` objects, thereby avoiding the N+1 query problem."
          ]
        },
        "create_time": 1701966438.728553
      }
    }
  ],
  "source_conversation_sha256": "afb657a479939298e6b891b4ebc7ed98c56b96910f2f2de081e4ecdd2f2ae259",
  "start": "2023-12-07T16:26:45.333439+00:00",
  "temporal_source": "first developer turn in parsed conversation",
  "temporal_status": "derivable",
  "visible_turns": [
    {
      "create_time": 1701966405.333439,
      "event_index": 2,
      "role": "user",
      "source_node_id": "aaa282e0-4531-4b49-b652-bfc65323c06c",
      "source_parent_id": "fb2bea42-89dc-43bd-9be3-4f526711ee58",
      "source_record_index": 2,
      "text": "is there a N+1 potential in this django code?\n\ndef tune_list(request):\n     user = request.user\n     rep_tunes = RepertoireTune.objects.filter(player=user)\n     tunes = [tune.tune for tune in rep_tunes]",
      "turn_id": "turn_000002"
    },
    {
      "create_time": 1701966438.728553,
      "event_index": 3,
      "role": "assistant",
      "source_node_id": "a120caf2-5c49-4f51-bb47-388f93904fe1",
      "source_parent_id": "aaa282e0-4531-4b49-b652-bfc65323c06c",
      "source_record_index": 3,
      "text": "To evaluate the potential for an N+1 query issue in the provided Django code, let's examine how the queries and data retrieval are structured:\n\nThe code you provided does the following:\n\n1. It fetches `RepertoireTune` objects that are filtered by `player=user`.\n2. Then, it iterates over these objects to access the `tune` attribute of each `RepertoireTune`.\n\n```python\nrep_tunes = RepertoireTune.objects.filter(player=user)\ntunes = [tune.tune for tune in rep_tunes]\n```\n\nAn N+1 problem arises when a query inside a loop leads to a scenario where one initial query is made to retrieve N objects, and then additional queries are made for each of these N objects, resulting in N+1 total queries. This can severely impact performance, especially as N grows larger.\n\nIn this code, the potential N+1 issue depends on how the `tune` attribute is defined in the `RepertoireTune` model. If `tune` is a ForeignKey or a OneToOneField, then accessing `tune.tune` for each `RepertoireTune` object in the list could result in additional queries to the database, one for each `RepertoireTune` object. This is a classic N+1 problem.\n\nTo fix this, you could use `select_related` which is designed for this exact scenario. `select_related` will perform a SQL join and fetch the related objects in the same database query. Here's how you would modify the code:\n\n```python\nrep_tunes = RepertoireTune.objects.filter(player=user).select_related('tune')\ntunes = [tune.tune for tune in rep_tunes]\n```\n\nWith `select_related('tune')`, Django will fetch the related `tune` objects in the same query used to fetch `RepertoireTune` objects, thereby avoiding the N+1 query problem.",
      "turn_id": "turn_000003"
    }
  ]
}
