{
  "candidate_producer_version": "generated-technical-content-v2",
  "case_id": "CASE_82C8812C7E0F",
  "complete": true,
  "generated_technical_content_candidates": [
    {
      "candidate_id": "GTC_000003_000000_001011_f0e444f2c1e47208",
      "completeness": "fragment",
      "container": "none",
      "continuation_status": "none",
      "detector": {
        "name": "generated-technical-content-v2",
        "version": "2"
      },
      "detector_evidence": [
        "braces",
        "call_expression"
      ],
      "end_offset": 1011,
      "fence_language": null,
      "kind": "source_code",
      "legacy_artifact_id": null,
      "order_within_response": 1,
      "raw_text": "When defining default values for arguments in a Python class or function, it's generally recommended to use `None` instead of mutable default values like an empty dictionary (`{}`). This is due to the way Python handles default argument values.\n\nHere's a brief explanation:\n\n1. **Mutable Default Arguments (like `{}`)**: When you use a mutable default argument like an empty dictionary, Python creates it once when the function is defined, not each time the function is called. This means if the dictionary is modified (like adding a key-value pair) during one call, those changes will persist in subsequent calls. This can lead to unexpected behaviors and bugs.\n\n2. **Immutable Default Arguments (like `None`)**: Using an immutable default argument, such as `None`, avoids this issue. Inside the function or method, you can check if the argument is `None` and, if so, initialize a new empty dictionary. This ensures that each call to the function gets a fresh dictionary.\n\nHere’s an example to illustrate this:",
      "raw_text_sha256": "f0e444f2c1e472081a159637b45e8fa09ce880f8dcc4a4c9a7583f16a2dee2b9",
      "source_event_index": 3,
      "source_record_index": 3,
      "source_response_id": "turn_000003",
      "source_turn_text_sha256": "3d8f347de1b4206179ed59d456ba5d80502c65ba6b47e53955b8ee05eb41d3ec",
      "start_offset": 0,
      "status": "candidate_requires_semantic_review"
    },
    {
      "candidate_id": "GTC_000003_001023_001149_0bb94e6011edc77a",
      "completeness": "complete",
      "container": "markdown_fence",
      "continuation_status": "none",
      "detector": {
        "name": "generated-technical-content-v2",
        "version": "2"
      },
      "detector_evidence": [
        "complete_standalone_markdown_fence",
        "declaration",
        "control_flow",
        "braces",
        "call_expression"
      ],
      "end_offset": 1149,
      "fence_language": "python",
      "kind": "source_code",
      "legacy_artifact_id": "ARTIFACT_000003_001",
      "order_within_response": 2,
      "raw_text": "def example_function(arg=None):\n    if arg is None:\n        arg = {}\n    # proceed with the function using the arg dictionary\n",
      "raw_text_sha256": "0bb94e6011edc77a7a97ce9490331180964fd188294acf2c8d8a12edf85d1568",
      "source_event_index": 3,
      "source_record_index": 3,
      "source_response_id": "turn_000003",
      "source_turn_text_sha256": "3d8f347de1b4206179ed59d456ba5d80502c65ba6b47e53955b8ee05eb41d3ec",
      "start_offset": 1023,
      "status": "candidate_requires_semantic_review"
    }
  ],
  "methodology_version": "dir-tfg-v2",
  "package_version": "conversation-only-v2",
  "precision": "timestamp",
  "reconstruction_safe": false,
  "records": [
    {},
    {},
    {
      "message": {
        "author": {
          "role": "user"
        },
        "content": {
          "content_type": "text",
          "parts": [
            "For Python class or function, is it better to make argument default value as None or empty dictionary such as {}?"
          ]
        },
        "create_time": 1702015830.03175
      }
    },
    {
      "message": {
        "author": {
          "role": "assistant"
        },
        "content": {
          "content_type": "text",
          "parts": [
            "When defining default values for arguments in a Python class or function, it's generally recommended to use `None` instead of mutable default values like an empty dictionary (`{}`). This is due to the way Python handles default argument values.\n\nHere's a brief explanation:\n\n1. **Mutable Default Arguments (like `{}`)**: When you use a mutable default argument like an empty dictionary, Python creates it once when the function is defined, not each time the function is called. This means if the dictionary is modified (like adding a key-value pair) during one call, those changes will persist in subsequent calls. This can lead to unexpected behaviors and bugs.\n\n2. **Immutable Default Arguments (like `None`)**: Using an immutable default argument, such as `None`, avoids this issue. Inside the function or method, you can check if the argument is `None` and, if so, initialize a new empty dictionary. This ensures that each call to the function gets a fresh dictionary.\n\nHere’s an example to illustrate this:\n\n```python\ndef example_function(arg=None):\n    if arg is None:\n        arg = {}\n    # proceed with the function using the arg dictionary\n```\n\nThis approach is safer and avoids the common pitfall of mutable default arguments."
          ]
        },
        "create_time": 1702015845.819429
      }
    }
  ],
  "source_conversation_sha256": "06af8abb17ae598bd0a0fb31e236dc5e31ef9510b9921f23255f9bee02adc7b5",
  "start": "2023-12-08T06:10:30.031750+00:00",
  "temporal_source": "first developer turn in parsed conversation",
  "temporal_status": "derivable",
  "visible_turns": [
    {
      "create_time": 1702015830.03175,
      "event_index": 2,
      "role": "user",
      "source_node_id": "aaa2c9e6-d59d-4221-8f47-71b64a89cc95",
      "source_parent_id": "3ba7d2e6-bb99-4260-b8a2-7bd969c1f108",
      "source_record_index": 2,
      "text": "For Python class or function, is it better to make argument default value as None or empty dictionary such as {}?",
      "turn_id": "turn_000002"
    },
    {
      "create_time": 1702015845.819429,
      "event_index": 3,
      "role": "assistant",
      "source_node_id": "9ffbe39f-42d4-4733-ab49-5aa76e2d067d",
      "source_parent_id": "aaa2c9e6-d59d-4221-8f47-71b64a89cc95",
      "source_record_index": 3,
      "text": "When defining default values for arguments in a Python class or function, it's generally recommended to use `None` instead of mutable default values like an empty dictionary (`{}`). This is due to the way Python handles default argument values.\n\nHere's a brief explanation:\n\n1. **Mutable Default Arguments (like `{}`)**: When you use a mutable default argument like an empty dictionary, Python creates it once when the function is defined, not each time the function is called. This means if the dictionary is modified (like adding a key-value pair) during one call, those changes will persist in subsequent calls. This can lead to unexpected behaviors and bugs.\n\n2. **Immutable Default Arguments (like `None`)**: Using an immutable default argument, such as `None`, avoids this issue. Inside the function or method, you can check if the argument is `None` and, if so, initialize a new empty dictionary. This ensures that each call to the function gets a fresh dictionary.\n\nHere’s an example to illustrate this:\n\n```python\ndef example_function(arg=None):\n    if arg is None:\n        arg = {}\n    # proceed with the function using the arg dictionary\n```\n\nThis approach is safer and avoids the common pitfall of mutable default arguments.",
      "turn_id": "turn_000003"
    }
  ]
}
